{
  "awp": "0.4.0",
  "id": "urn:awp:workspace:clawd-template-example",
  "name": "clawd-workspace",
  "created": "2026-01-28T00:00:00.000Z",
  "agent": {
    "identityFile": "IDENTITY.md"
  },
  "capabilities": ["coding", "research", "memory", "coordination"],
  "protocols": {
    "a2a": true,
    "mcp": true
  }
}
